{
  "schemaVersion": "temporal-trace/v1",
  "artifactId": "trace:fallback-wins:fallback-wins-run-id",
  "metadata": {
    "temporalExplorerVersion": "0.0.1-mvp",
    "schemaVersion": "temporal-trace/v1",
    "inputs": {
      "projectRoot": "promise-any",
      "configHash": "1878d1973aec45603e40629d71d21ed0fd7eaf3cc864df76d8e4a223fe1605de",
      "sourceFileHashes": {},
      "temporalSdkVersions": {
        "@temporalio/workflow": "^1.18.1"
      }
    }
  },
  "execution": {
    "workflowType": "regionWorkflow",
    "workflowId": "promise-any-fallback-wins",
    "runId": "fallback-wins-run-id",
    "status": "completed",
    "startedAt": "2026-01-01T00:00:00.001Z",
    "closedAt": "2026-01-01T00:00:00.017Z",
    "durationMs": 16
  },
  "source": {
    "taskQueue": "promise-any-task-queue",
    "eventCount": 17,
    "importedFrom": "file"
  },
  "operations": [
    {
      "id": "workflow:start",
      "kind": "workflow-lifecycle",
      "status": "started",
      "eventReferences": [
        {
          "eventId": 1,
          "eventType": "WorkflowExecutionStarted"
        }
      ],
      "payloadReferences": ["payload:event-1:input:0"]
    },
    {
      "id": "workflow:completed",
      "kind": "workflow-lifecycle",
      "status": "completed",
      "eventReferences": [
        {
          "eventId": 17,
          "eventType": "WorkflowExecutionCompleted"
        }
      ],
      "payloadReferences": ["payload:event-17:result:0"]
    },
    {
      "id": "activity:queryPrimaryRegion:5",
      "kind": "activity",
      "activityType": "queryPrimaryRegion",
      "activityId": "1",
      "status": "failed",
      "attempts": [
        {
          "attempt": 1,
          "scheduledEventId": 5,
          "startedEventId": 7,
          "closedEventId": 8,
          "status": "failed"
        }
      ],
      "firstScheduledAt": "2026-01-01T00:00:00.005Z",
      "closedAt": "2026-01-01T00:00:00.008Z",
      "durationMs": 3,
      "eventReferences": [
        {
          "eventId": 5,
          "eventType": "ActivityTaskScheduled"
        },
        {
          "eventId": 7,
          "eventType": "ActivityTaskStarted"
        },
        {
          "eventId": 8,
          "eventType": "ActivityTaskFailed"
        }
      ],
      "payloadReferences": ["payload:event-5:input:0"]
    },
    {
      "id": "activity:queryFallbackRegion:6",
      "kind": "activity",
      "activityType": "queryFallbackRegion",
      "activityId": "2",
      "status": "completed",
      "attempts": [
        {
          "attempt": 1,
          "scheduledEventId": 6,
          "startedEventId": 12,
          "closedEventId": 13,
          "status": "completed"
        }
      ],
      "firstScheduledAt": "2026-01-01T00:00:00.006Z",
      "closedAt": "2026-01-01T00:00:00.013Z",
      "durationMs": 7,
      "eventReferences": [
        {
          "eventId": 6,
          "eventType": "ActivityTaskScheduled"
        },
        {
          "eventId": 12,
          "eventType": "ActivityTaskStarted"
        },
        {
          "eventId": 13,
          "eventType": "ActivityTaskCompleted"
        }
      ],
      "payloadReferences": ["payload:event-6:input:0", "payload:event-13:result:0"]
    }
  ],
  "timeline": [
    {
      "id": "timeline:1",
      "operationId": "workflow:start",
      "at": "2026-01-01T00:00:00.001Z",
      "label": "Workflow started",
      "eventIds": [1]
    },
    {
      "id": "timeline:5",
      "operationId": "activity:queryPrimaryRegion:5",
      "at": "2026-01-01T00:00:00.005Z",
      "label": "queryPrimaryRegion scheduled",
      "eventIds": [5]
    },
    {
      "id": "timeline:6",
      "operationId": "activity:queryFallbackRegion:6",
      "at": "2026-01-01T00:00:00.006Z",
      "label": "queryFallbackRegion scheduled",
      "eventIds": [6]
    },
    {
      "id": "timeline:8",
      "operationId": "activity:queryPrimaryRegion:5",
      "at": "2026-01-01T00:00:00.008Z",
      "label": "queryPrimaryRegion failed",
      "eventIds": [8]
    },
    {
      "id": "timeline:13",
      "operationId": "activity:queryFallbackRegion:6",
      "at": "2026-01-01T00:00:00.013Z",
      "label": "queryFallbackRegion completed",
      "eventIds": [13]
    },
    {
      "id": "timeline:closed:17",
      "operationId": "workflow:completed",
      "at": "2026-01-01T00:00:00.017Z",
      "label": "Workflow closed",
      "eventIds": [17]
    }
  ],
  "payloads": [
    {
      "id": "payload:event-1:input:0",
      "eventId": 1,
      "kind": "input",
      "decoded": false,
      "redacted": true
    },
    {
      "id": "payload:event-17:result:0",
      "eventId": 17,
      "kind": "result",
      "decoded": false,
      "redacted": true
    },
    {
      "id": "payload:event-5:input:0",
      "eventId": 5,
      "kind": "input",
      "decoded": false,
      "redacted": true
    },
    {
      "id": "payload:event-6:input:0",
      "eventId": 6,
      "kind": "input",
      "decoded": false,
      "redacted": true
    },
    {
      "id": "payload:event-13:result:0",
      "eventId": 13,
      "kind": "result",
      "decoded": false,
      "redacted": true
    }
  ],
  "diagnostics": []
}
