{
  "schemaVersion": "temporal-trace/v1",
  "artifactId": "trace:reserved:reserved-run-id",
  "metadata": {
    "temporalExplorerVersion": "0.0.1-mvp",
    "schemaVersion": "temporal-trace/v1",
    "inputs": {
      "projectRoot": "parallel",
      "configHash": "05dfd212cc3e4eb7fb625f207248ad896e33fdf9b05ac89920a1b15e28edce91",
      "sourceFileHashes": {},
      "temporalSdkVersions": {
        "@temporalio/workflow": "^1.18.1"
      }
    }
  },
  "execution": {
    "workflowType": "parallelWorkflow",
    "workflowId": "parallel-reserved",
    "runId": "reserved-run-id",
    "status": "completed",
    "startedAt": "2026-01-01T00:00:00.001Z",
    "closedAt": "2026-01-01T00:00:00.029Z",
    "durationMs": 28
  },
  "source": {
    "taskQueue": "parallel-task-queue",
    "eventCount": 29,
    "importedFrom": "file"
  },
  "operations": [
    {
      "id": "workflow:start",
      "kind": "workflow-lifecycle",
      "status": "started",
      "eventReferences": [
        {
          "eventId": 1,
          "eventType": "WorkflowExecutionStarted"
        }
      ],
      "payloadReferences": ["payload:event-1:input:0"]
    },
    {
      "id": "workflow:completed",
      "kind": "workflow-lifecycle",
      "status": "completed",
      "eventReferences": [
        {
          "eventId": 29,
          "eventType": "WorkflowExecutionCompleted"
        }
      ],
      "payloadReferences": ["payload:event-29:result:0"]
    },
    {
      "id": "activity:validateRequest:5",
      "kind": "activity",
      "activityType": "validateRequest",
      "activityId": "1",
      "status": "completed",
      "attempts": [
        {
          "attempt": 1,
          "scheduledEventId": 5,
          "startedEventId": 6,
          "closedEventId": 7,
          "status": "completed"
        }
      ],
      "firstScheduledAt": "2026-01-01T00:00:00.005Z",
      "closedAt": "2026-01-01T00:00:00.007Z",
      "durationMs": 2,
      "eventReferences": [
        {
          "eventId": 5,
          "eventType": "ActivityTaskScheduled"
        },
        {
          "eventId": 6,
          "eventType": "ActivityTaskStarted"
        },
        {
          "eventId": 7,
          "eventType": "ActivityTaskCompleted"
        }
      ],
      "payloadReferences": ["payload:event-5:input:0", "payload:event-7:result:0"]
    },
    {
      "id": "activity:reserveInventory:11",
      "kind": "activity",
      "activityType": "reserveInventory",
      "activityId": "2",
      "status": "completed",
      "attempts": [
        {
          "attempt": 1,
          "scheduledEventId": 11,
          "startedEventId": 13,
          "closedEventId": 14,
          "status": "completed"
        }
      ],
      "firstScheduledAt": "2026-01-01T00:00:00.011Z",
      "closedAt": "2026-01-01T00:00:00.014Z",
      "durationMs": 3,
      "eventReferences": [
        {
          "eventId": 11,
          "eventType": "ActivityTaskScheduled"
        },
        {
          "eventId": 13,
          "eventType": "ActivityTaskStarted"
        },
        {
          "eventId": 14,
          "eventType": "ActivityTaskCompleted"
        }
      ],
      "payloadReferences": ["payload:event-11:input:0", "payload:event-14:result:0"]
    },
    {
      "id": "activity:reserveShipping:12",
      "kind": "activity",
      "activityType": "reserveShipping",
      "activityId": "3",
      "status": "completed",
      "attempts": [
        {
          "attempt": 1,
          "scheduledEventId": 12,
          "startedEventId": 18,
          "closedEventId": 19,
          "status": "completed"
        }
      ],
      "firstScheduledAt": "2026-01-01T00:00:00.012Z",
      "closedAt": "2026-01-01T00:00:00.019Z",
      "durationMs": 7,
      "eventReferences": [
        {
          "eventId": 12,
          "eventType": "ActivityTaskScheduled"
        },
        {
          "eventId": 18,
          "eventType": "ActivityTaskStarted"
        },
        {
          "eventId": 19,
          "eventType": "ActivityTaskCompleted"
        }
      ],
      "payloadReferences": ["payload:event-12:input:0", "payload:event-19:result:0"]
    },
    {
      "id": "activity:confirmReservation:23",
      "kind": "activity",
      "activityType": "confirmReservation",
      "activityId": "4",
      "status": "completed",
      "attempts": [
        {
          "attempt": 1,
          "scheduledEventId": 23,
          "startedEventId": 24,
          "closedEventId": 25,
          "status": "completed"
        }
      ],
      "firstScheduledAt": "2026-01-01T00:00:00.023Z",
      "closedAt": "2026-01-01T00:00:00.025Z",
      "durationMs": 2,
      "eventReferences": [
        {
          "eventId": 23,
          "eventType": "ActivityTaskScheduled"
        },
        {
          "eventId": 24,
          "eventType": "ActivityTaskStarted"
        },
        {
          "eventId": 25,
          "eventType": "ActivityTaskCompleted"
        }
      ],
      "payloadReferences": [
        "payload:event-23:input:0",
        "payload:event-23:input:1",
        "payload:event-25:result:0"
      ]
    }
  ],
  "timeline": [
    {
      "id": "timeline:1",
      "operationId": "workflow:start",
      "at": "2026-01-01T00:00:00.001Z",
      "label": "Workflow started",
      "eventIds": [1]
    },
    {
      "id": "timeline:5",
      "operationId": "activity:validateRequest:5",
      "at": "2026-01-01T00:00:00.005Z",
      "label": "validateRequest scheduled",
      "eventIds": [5]
    },
    {
      "id": "timeline:7",
      "operationId": "activity:validateRequest:5",
      "at": "2026-01-01T00:00:00.007Z",
      "label": "validateRequest completed",
      "eventIds": [7]
    },
    {
      "id": "timeline:11",
      "operationId": "activity:reserveInventory:11",
      "at": "2026-01-01T00:00:00.011Z",
      "label": "reserveInventory scheduled",
      "eventIds": [11]
    },
    {
      "id": "timeline:12",
      "operationId": "activity:reserveShipping:12",
      "at": "2026-01-01T00:00:00.012Z",
      "label": "reserveShipping scheduled",
      "eventIds": [12]
    },
    {
      "id": "timeline:14",
      "operationId": "activity:reserveInventory:11",
      "at": "2026-01-01T00:00:00.014Z",
      "label": "reserveInventory completed",
      "eventIds": [14]
    },
    {
      "id": "timeline:19",
      "operationId": "activity:reserveShipping:12",
      "at": "2026-01-01T00:00:00.019Z",
      "label": "reserveShipping completed",
      "eventIds": [19]
    },
    {
      "id": "timeline:23",
      "operationId": "activity:confirmReservation:23",
      "at": "2026-01-01T00:00:00.023Z",
      "label": "confirmReservation scheduled",
      "eventIds": [23]
    },
    {
      "id": "timeline:25",
      "operationId": "activity:confirmReservation:23",
      "at": "2026-01-01T00:00:00.025Z",
      "label": "confirmReservation completed",
      "eventIds": [25]
    },
    {
      "id": "timeline:closed:29",
      "operationId": "workflow:completed",
      "at": "2026-01-01T00:00:00.029Z",
      "label": "Workflow closed",
      "eventIds": [29]
    }
  ],
  "payloads": [
    {
      "id": "payload:event-1:input:0",
      "eventId": 1,
      "kind": "input",
      "decoded": false,
      "redacted": true
    },
    {
      "id": "payload:event-29:result:0",
      "eventId": 29,
      "kind": "result",
      "decoded": false,
      "redacted": true
    },
    {
      "id": "payload:event-5:input:0",
      "eventId": 5,
      "kind": "input",
      "decoded": false,
      "redacted": true
    },
    {
      "id": "payload:event-7:result:0",
      "eventId": 7,
      "kind": "result",
      "decoded": false,
      "redacted": true
    },
    {
      "id": "payload:event-11:input:0",
      "eventId": 11,
      "kind": "input",
      "decoded": false,
      "redacted": true
    },
    {
      "id": "payload:event-12:input:0",
      "eventId": 12,
      "kind": "input",
      "decoded": false,
      "redacted": true
    },
    {
      "id": "payload:event-14:result:0",
      "eventId": 14,
      "kind": "result",
      "decoded": false,
      "redacted": true
    },
    {
      "id": "payload:event-19:result:0",
      "eventId": 19,
      "kind": "result",
      "decoded": false,
      "redacted": true
    },
    {
      "id": "payload:event-23:input:0",
      "eventId": 23,
      "kind": "input",
      "decoded": false,
      "redacted": true
    },
    {
      "id": "payload:event-23:input:1",
      "eventId": 23,
      "kind": "input",
      "decoded": false,
      "redacted": true
    },
    {
      "id": "payload:event-25:result:0",
      "eventId": 25,
      "kind": "result",
      "decoded": false,
      "redacted": true
    }
  ],
  "diagnostics": []
}
